{
  "schemaVersion": "quiz-funnel.v2",
  "slug": "symptom-profile-v2",
  "name": "the hidden pattern symptom profile",
  "description": "a premium monochrome symptom profile that qualifies the visitor, delivers interstitial insight, runs an animated analysis, and ends with a structured result report plus next-step offer.",
  "estimatedMinutes": 4,
  "theme": {
    "variant": "monochrome-premium",
    "typeface": "sans",
    "motion": "smooth"
  },
  "entrypoints": [
    {
      "id": "homepage-hero",
      "label": "homepage hero",
      "source": "homepage-hero",
      "pathHint": "/"
    },
    {
      "id": "article-cta",
      "label": "article cta",
      "source": "article-inline-cta",
      "pathHint": "/articles/[slug]"
    },
    {
      "id": "direct",
      "label": "direct quiz visit",
      "source": "direct",
      "pathHint": "/quiz/symptom-profile-v2"
    }
  ],
  "results": [
    {
      "id": "stress-drift",
      "label": "stress drift",
      "badge": "nervous system heavy",
      "affirmation": "your body is not being difficult. it is broadcasting a system that has stayed over-activated for too long.",
      "headline": "your answers lean toward stress drift",
      "summary": "the pattern in your answers is less about discipline and more about overload. sleep gets lighter, cravings get louder, and your body starts feeling expensive to manage.",
      "mechanism": "when stress chemistry stays elevated, the body gets noisier. recovery gets shallower, appetite cues get less stable, and small symptoms stop feeling isolated.",
      "educationBullets": [
        "sleep fragmentation and overstimulation often travel together before people call it stress.",
        "puffiness, irritability, and sugar-seeking can be downstream of the same stress loop.",
        "the fastest win is usually reducing signal chaos, not adding a harsher routine."
      ],
      "dopamineCandies": [
        "this pattern is common in people who are still functioning.",
        "feeling reactive is a signal, not a character flaw.",
        "you do not need a more punishing reset."
      ],
      "offerBridge": "the next move should lower friction fast, calm the signal load, and be easy to repeat on your messiest days.",
      "graphTitle": "how your answers stacked up",
      "graphCaption": "the strongest pull is in stress load and signal volatility, with sleep and recovery lagging behind.",
      "metrics": [
        {
          "id": "stress-load",
          "label": "stress load",
          "value": 86
        },
        {
          "id": "sleep-stability",
          "label": "sleep stability",
          "value": 38
        },
        {
          "id": "recovery-reserve",
          "label": "recovery reserve",
          "value": 44
        },
        {
          "id": "signal-volatility",
          "label": "signal volatility",
          "value": 79
        }
      ],
      "criteria": [
        {
          "id": "wired-tired",
          "label": "wired-tired sleep profile",
          "detail": "your sleep answers match a body that stays switched on even when it is exhausted.",
          "emphasis": "high"
        },
        {
          "id": "mood-reactivity",
          "label": "reactive mood pattern",
          "detail": "the irritability and overstimulation pattern is strong enough to count as a cluster, not a one-off.",
          "emphasis": "high"
        },
        {
          "id": "support-gap",
          "label": "support gap",
          "detail": "your recovery answers suggest the system is absorbing more than it is restoring.",
          "emphasis": "steady"
        }
      ]
    },
    {
      "id": "hormone-friction",
      "label": "hormone friction",
      "badge": "cycle and regulation heavy",
      "affirmation": "the pattern in your answers suggests a body dealing with more friction than support, not a body that is randomly failing.",
      "headline": "your answers lean toward hormone friction",
      "summary": "the strongest signal here is inconsistency. sleep, cravings, bloating, and mood do not feel random, but they do feel harder to predict than they used to.",
      "mechanism": "when hormone-related signals lose stability, the body can swing between better and worse days without obvious explanation. that usually feels personal when it is actually patterned.",
      "educationBullets": [
        "hormone friction often shows up as inconsistency before it shows up as something dramatic.",
        "bloating, cravings, and mood swings often belong to the same conversation.",
        "stability improves faster with believable routines than with extreme protocols."
      ],
      "dopamineCandies": [
        "your symptoms make more sense together than separately.",
        "a harder routine is not the same thing as better support.",
        "you are allowed to want steadier days."
      ],
      "offerBridge": "the right next step should make daily regulation feel easier and more consistent without turning your life into a full-time protocol.",
      "graphTitle": "how your answers stacked up",
      "graphCaption": "the biggest load is in signal inconsistency and cycle-linked friction, with recovery only partially keeping up.",
      "metrics": [
        {
          "id": "cycle-friction",
          "label": "cycle friction",
          "value": 83
        },
        {
          "id": "signal-consistency",
          "label": "signal consistency",
          "value": 41
        },
        {
          "id": "bloat-pressure",
          "label": "bloat pressure",
          "value": 76
        },
        {
          "id": "recovery-reserve",
          "label": "recovery reserve",
          "value": 52
        }
      ],
      "criteria": [
        {
          "id": "unpredictable-mood",
          "label": "unpredictable mood shifts",
          "detail": "your mood pattern reads as cyclical and harder to forecast, not simply low-energy.",
          "emphasis": "high"
        },
        {
          "id": "digestive-signal",
          "label": "digestion and puffiness signal",
          "detail": "the bloating and cravings answers point toward a pattern that rises with hormonal noise.",
          "emphasis": "high"
        },
        {
          "id": "recovery-cushion",
          "label": "recovery cushion still present",
          "detail": "you still have some reserve, which means consistent support has room to work quickly.",
          "emphasis": "steady"
        }
      ]
    },
    {
      "id": "recovery-debt",
      "label": "recovery debt",
      "badge": "energy reserve heavy",
      "affirmation": "your answers point to a body that has been spending more than it has been restoring.",
      "headline": "your answers lean toward recovery debt",
      "summary": "the strongest signal in your answers is depletion. it is the feeling of still doing life while carrying less reserve, less bounce-back, and less clarity than before.",
      "mechanism": "recovery debt builds when sleep quality, nutritional steadiness, and daily output stop paying you back. the result is lower reserve, slower bounce-back, and a body that feels heavier to carry.",
      "educationBullets": [
        "brain fog and slower bounce-back often show up before people call the pattern depletion.",
        "flat energy plus lower resilience is usually a reserve problem, not a motivation problem.",
        "support that reduces daily friction can help more than another ambitious restart."
      ],
      "dopamineCandies": [
        "lower reserve is not the same thing as lower capability.",
        "a believable system beats a heroic plan.",
        "capacity can rebuild once the baseline stops sliding."
      ],
      "offerBridge": "the best next step is the one that makes recovery feel easier to stack day after day, instead of demanding more output from a low-battery system.",
      "graphTitle": "how your answers stacked up",
      "graphCaption": "the biggest drop is in reserve and bounce-back, with sleep and consistency both underperforming.",
      "metrics": [
        {
          "id": "recovery-reserve",
          "label": "recovery reserve",
          "value": 31
        },
        {
          "id": "bounce-back",
          "label": "bounce-back",
          "value": 34
        },
        {
          "id": "sleep-depth",
          "label": "sleep depth",
          "value": 43
        },
        {
          "id": "signal-stability",
          "label": "signal stability",
          "value": 49
        }
      ],
      "criteria": [
        {
          "id": "low-battery",
          "label": "low-battery mornings",
          "detail": "the sleep and energy answers point to a body waking up without enough payback.",
          "emphasis": "high"
        },
        {
          "id": "longer-rebound",
          "label": "longer rebound window",
          "detail": "your body looks slower to recover from normal output than it should feel.",
          "emphasis": "high"
        },
        {
          "id": "stress-overlap",
          "label": "stress overlap",
          "detail": "stress is present, but it looks more like a reserve drain than the primary story.",
          "emphasis": "watch"
        }
      ]
    }
  ],
  "steps": [
    {
      "id": "welcome",
      "kind": "welcome",
      "kicker": "four minute private read",
      "title": "your body is probably sending one pattern through several tiny symptoms.",
      "body": "this is a mobile-first symptom profile built to feel sharp, quick, and specific. no generic score. no beige wellness fog. just a cleaner read on what your answers most likely point to.",
      "primaryLabel": "start my profile",
      "secondaryLabel": "radio-select questions, then a real result report",
      "trustPoints": [
        "single-select flow",
        "animated analysis pass",
        "result graph + criteria"
      ],
      "next": "age-window"
    },
    {
      "id": "age-window",